{
  "schema_version": "h2-calibration-plan-v1",
  "plan_version": "h2_calibration_demo_v1",
  "h2_scheme_version": "T_v1-2026-pre1",
  "grnti_excerpt_version": "grnti_excerpt_demo_v1",
  "candidate_frame_id": "h2_candidates_demo_v1",
  "source_candidate_manifest_path": "manifests/works.jsonl",
  "source_candidate_manifest_sha256": "bbbbbbbbbbbbbbbbbbbbbbbbbbbbbbbbbbbbbbbbbbbbbbbbbbbbbbbbbbbbbbbb",
  "selection_seed": 20260827,
  "selection_method": "random_within_frozen_strata",
  "total_n": 30,
  "clean_total_n": 15,
  "clean_quotas": {"C1": 3, "C2": 3, "C3": 3, "C4": 3, "C5": 3},
  "challenge_total_n": 15,
  "challenge_quotas": [
    {"stratum_id": "boundary_hep_nuclear", "boundary_codes": ["29.05", "29.15"], "search_basis": ["catalog_grnti", "keywords"], "target_n": 2},
    {"stratum_id": "boundary_hep_general_quantum", "boundary_codes": ["29.05", "general_quantum_theory"], "search_basis": ["pacs", "keywords"], "target_n": 2},
    {"stratum_id": "boundary_nuclear_engineering", "boundary_codes": ["29.15", "58"], "search_basis": ["catalog_grnti", "udc"], "target_n": 2},
    {"stratum_id": "boundary_solid_materials_electronics", "boundary_codes": ["29.19", "29.35", "31", "53"], "search_basis": ["catalog_grnti", "journal_scope"], "target_n": 2},
    {"stratum_id": "boundary_plasma_laser_mechanics_fusion", "boundary_codes": ["29.27", "29.33", "30", "58"], "search_basis": ["pacs", "keywords", "publisher_section"], "target_n": 2},
    {"stratum_id": "boundary_laser_photonics_optics_atomic", "boundary_codes": ["29.33", "29.32", "29.31", "29.29", "47"], "search_basis": ["catalog_grnti", "keywords"], "target_n": 2},
    {"stratum_id": "excluded_branch", "boundary_codes": ["29.17"], "search_basis": ["catalog_grnti"], "target_n": 1},
    {"stratum_id": "dual_target_codes", "boundary_codes": ["29.05", "29.15"], "search_basis": ["multiple_codes"], "target_n": 1},
    {"stratum_id": "incomplete_metadata", "boundary_codes": ["metadata_gap"], "search_basis": ["missing_metadata"], "target_n": 1}
  ],
  "challenge_strata_are_search_hints": true,
  "deduplication_rule_version": "work-id-dedup-demo-v1",
  "fallback_order": ["same_stratum_new_work", "same_boundary_other_source", "record_shortfall"],
  "audit_overlap_forbidden": true,
  "seen_by_annotators": true,
  "annotation_blinding_required": true,
  "allowed_classification_splits": ["train"],
  "created_at": "2026-08-27T15:10:00+03:00"
}
